Symbol,Name,Last Sale,Net Change,% Change,Market Cap,Country,IPO Year,Volume,Sector,Industry
PAGP,Plains GP Holdings L.P. Class A Units representing Limited Partner Interests,$8.75 ,0.0699,0.81%,1643112160,United States,,56164,Energy,Natural Gas Distribution
PAHC,Phibro Animal Health Corporation Class A Common Stock,$22.55 ,-0.06,-0.27%,912228860,United States,2014,4408,Health Care,Major Pharmaceuticals
PAND,Pandion Therapeutics Inc. Common Stock,$25.31 ,0.204,0.81%,747266799,United States,2020,3512,Health Care,Major Pharmaceuticals
PANL,Pangaea Logistics Solutions Ltd. Common Shares,$3.02 ,0.04,1.34%,136098299,United States,2013,8545,Transportation,Marine Transportation
PASG,Passage Bio Inc. Common Stock,$18.11 ,-0.02,-0.11%,958328391,United States,2020,9525,Health Care,Biotechnology: Biological Products (No Diagnostic Substances)
PATK,Patrick Industries Inc. Common Stock,$82.36 ,0.67,0.82%,1924186893,United States,,5843,Capital Goods,Auto Parts:O.E.M.
PAVM,PAVmed Inc. Common Stock,$4.57 ,0.105,2.35%,328242988,United States,2016,398988,Health Care,Medical/Dental Instruments
PAX,Patria Investments Limited Class A Common Shares,$19.87 ,0.255,1.30%,2654957250,Cayman Islands,2021,1838,Finance,Investment Managers
PAYA,Paya Holdings Inc. Class A Common Stock,$12.14 ,-0.03,-0.25%,1416706934,United States,,16431,Miscellaneous,Business Services
PAYS,Paysign Inc. Common Stock,$4.84 ,0.04,0.83%,241247172,United States,,8400,Miscellaneous,Business Services
PAYX,Paychex Inc. Common Stock,$89.61 ,-1.27,-1.40%,32316158606,United States,1983,64379,Consumer Services,Diversified Commercial Services
PBCT,People's United Financial Inc. Common Stock,$18.87 ,0.135,0.72%,8011588200,United States,,907519,Finance,Savings Institutions
PBIP,Prudential Bancorp Inc. Common Stock,$13.99 ,0.13,0.94%,111876127,United States,,334,Finance,Banks
PBLA,Panbela Therapeutics Inc. Common Stock,$4.78 ,0.06,1.27%,46124261,United States,,1717,Health Care,Major Pharmaceuticals
PBPB,Potbelly Corporation Common Stock,$4.93 ,0.03,0.61%,137798810,United States,2013,8844,Consumer Services,Restaurants
PBTS,Powerbridge Technologies Co. Ltd. Ordinary Shares,$3.94 ,0.0999,2.60%,36245276,China,2019,4431,Technology,EDP Services
PBYI,Puma Biotechnology Inc Common Stock,$10.84 ,-0.049,-0.45%,431064514,United States,,8079,Health Care,Major Pharmaceuticals
PCAR,PACCAR Inc. Common Stock,$92.78 ,-0.555,-0.60%,32187063476,United States,,105867,Capital Goods,Auto Manufacturing
PCB,PCB Bancorp Common Stock,$13.83 ,0.12,0.88%,213687634,United States,2018,253,Finance,Major Banks
PCH,PotlatchDeltic Corporation Common Stock,$54.00 ,0.555,1.04%,3610810389,United States,,15196,Consumer Services,Real Estate Investment Trusts
PCRX,Pacira BioSciences Inc. Common Stock,$76.65 ,0.71,0.94%,3329959528,United States,2011,11070,Health Care,Major Pharmaceuticals
PCSA,Processa Pharmaceuticals Inc. Common Stock,$12.09 ,0.2,1.68%,127737693,United States,,334,Health Care,Major Pharmaceuticals
PCSB,PCSB Financial Corporation Common Stock,$16.70 ,0.04,0.24%,267820071,United States,2017,929,Finance,Banks
PCTI,PCTEL Inc. Common Stock,$7.66 ,-0.0399,-0.52%,143395333,United States,1999,6446,Technology,Radio And Television Broadcasting And Communications Equipment
PCTY,Paylocity Holding Corporation Common Stock,$190.76 ,-2.57,-1.33%,10372266732,United States,2014,8763,Technology,Computer Software: Prepackaged Software
PCVX,Vaxcyte Inc. Common Stock,$24.24 ,0.12,0.50%,1235020995,United States,2020,8300,Health Care,Biotechnology: Biological Products (No Diagnostic Substances)
PCYG,Park City Group Inc. Common Stock,$6.30 ,-0.115,-1.79%,122497792,United States,,4775,Technology,EDP Services
PCYO,Pure Cycle Corporation Common Stock,$11.99 ,0.0999,0.84%,286177523,United States,,644,Public Utilities,Water Supply
PDCE,PDC Energy Inc. Common Stock (Delaware),$31.68 ,0.36,1.15%,3156521481,United States,,26838,Energy,Oil & Gas Production
PDCO,Patterson Companies Inc. Common Stock,$31.81 ,-0.01,-0.03%,3069792240,United States,1992,8189,Health Care,Medical Specialities
PDD,Pinduoduo Inc. American Depositary Shares,$181.37 ,-6.54,-3.48%,2.22419E+11,China,2018,656889,Miscellaneous,Business Services
PDEX,Pro-Dex Inc. Common Stock,$25.14 ,0.19,0.76%,97056464,United States,,975,Health Care,Medical/Dental Instruments
PDFS,PDF Solutions Inc. Common Stock,$17.95 ,0.155,0.87%,657323645,United States,2001,4294,Technology,Computer Software: Prepackaged Software
PDSB,PDS Biotechnology Corporation Common Stock,$4.75 ,0.035,0.74%,105631382,United States,2015,69390,Health Care,Major Pharmaceuticals
PEBK,Peoples Bancorp of North Carolina Inc. Common Stock,$24.00 ,-0.24,-0.99%,138900096,United States,,420,Finance,Major Banks
PEBO,Peoples Bancorp Inc. Common Stock,$32.45 ,0.42,1.31%,633013702,United States,,2924,Finance,Major Banks
PEGA,Pegasystems Inc. Common Stock,$139.21 ,-1.77,-1.26%,11262177677,United States,1996,9204,Technology,EDP Services
PENN,Penn National Gaming Inc. Common Stock,$117.64 ,-1.75,-1.47%,18272350064,United States,1994,221297,Consumer Services,Hotels/Resorts
PEP,PepsiCo Inc. Common Stock,$131.39 ,-1.39,-1.05%,1.81267E+11,United States,,392244,Consumer Non-Durables,Beverages (Production/Distribution)
PERI,Perion Network Ltd. Ordinary Shares,$20.89 ,-0.4,-1.88%,691260002,Israel,,143258,Technology,EDP Services
PESI,Perma-Fix Environmental Services Inc. Common Stock,$6.73 ,-0.0234,-0.35%,81754404,United States,,898,Basic Industries,Environmental Services
PETQ,PetIQ Inc. Class A Common Stock,$33.80 ,0.23,0.69%,969946432,United States,2017,6544,Health Care,Other Pharmaceuticals
PETS,PetMed Express Inc. Common Stock,$34.21 ,0.44,1.30%,693475084,United States,,32802,Health Care,Medical/Nursing Services
PETZ,TDH Holdings Inc. Common Shares,$2.76 ,0.14,5.34%,126545986,China,2017,31436,Consumer Non-Durables,Packaged Foods
PFBC,Preferred Bank Common Stock,$59.11 ,1.59,2.76%,882719362,United States,,4083,,
PFG,Principal Financial Group Inc Common Stock,$59.06 ,0.38,0.65%,16100564118,United States,2001,105996,Finance,Accident &Health Insurance
PFHD,Professional Holding Corp. Class A Common stock,$16.10 ,-0.1,-0.62%,217926847,United States,2020,1186,Finance,Major Banks
PFIE,Profire Energy Inc. Common Stock,$1.11 ,0.01,0.91%,53235136,United States,,7882,Energy,Metal Fabrications
PFLT,PennantPark Floating Rate Capital Ltd. Common Stock,$11.94 ,-0.003,-0.03%,462822247,United States,,6111,,
PFMT,Performant Financial Corporation Common Stock,$1.34 ,0.03,2.29%,73373955,United States,2012,7985,Consumer Services,Other Consumer Services
PFPT,Proofpoint Inc. Common Stock,$124.14 ,-1.58,-1.26%,7098076920,United States,2012,19737,Technology,EDP Services
PFSW,PFSweb Inc. Common Stock,$7.50 ,0.05,0.67%,151861283,United States,1999,1004,Miscellaneous,Business Services
PGC,Peapack-Gladstone Financial Corporation Common Stock,$28.18 ,0.18,0.64%,534707131,United States,,1366,Finance,Commercial Banks
PGEN,Precigen Inc. Common Stock,$8.37 ,0.1,1.21%,1715053302,United States,,73986,Health Care,Major Pharmaceuticals
PGNY,Progyny Inc. Common Stock,$52.50 ,1.22,2.38%,4548266468,United States,2019,63153,Health Care,Misc Health and Biotechnology Services
PHAR,Pharming Group N.V. ADS each representing 10 ordinary shares,$13.50 ,0.54,4.17%,861375074,Netherlands,,2363,Health Care,Major Pharmaceuticals
PHAS,PhaseBio Pharmaceuticals Inc. Common Stock,$4.08 ,0.06,1.49%,119808482,United States,2018,9089,Health Care,Major Pharmaceuticals
PHAT,Phathom Pharmaceuticals Inc. Common Stock,$44.94 ,0.05,0.11%,1265784219,United States,2019,1270,Health Care,Major Pharmaceuticals
PHCF,Puhui Wealth Investment Management Co. Ltd. Ordinary Shares,$4.45 ,-0.2388,-5.09%,51222442,China,2018,22217,Finance,Investment Managers
PHIO,Phio Pharmaceuticals Corp. Common Stock,$3.30 ,0.08,2.48%,33666059,United States,,53720,Health Care,Major Pharmaceuticals
PHUN,Phunware Inc. Common Stock,$2.06 ,0.06,3.00%,121844831,Greece,2016,373944,Technology,EDP Services
PHVS,Pharvaris N.V. Ordinary Shares,$32.08 ,0.55,1.74%,1021420014,Netherlands,2021,6485,Health Care,Major Pharmaceuticals
PI,Impinj Inc. Common Stock,$65.62 ,-1.145,-1.72%,1535604052,United States,2016,27459,Capital Goods,Industrial Machinery/Components
PICO,PICO Holdings Inc. Common Stock (DE),$9.35 ,0.23,2.52%,174985867,United States,,449,Finance,Real Estate
PINC,Premier Inc. Class A Common Stock,$34.35 ,0.075,0.22%,4198289422,United States,2013,9174,Consumer Services,Other Consumer Services
PIRS,Pieris Pharmaceuticals Inc. Common Stock,$2.65 ,0.0399,1.53%,148316440,Germany,,16273,Health Care,Major Pharmaceuticals
PKBK,Parke Bancorp Inc. Common Stock,$19.10 ,-0.11,-0.57%,226370698,United States,,1051,Finance,Major Banks
PKOH,Park-Ohio Holdings Corp. Common Stock,$33.53 ,0.47,1.42%,423003147,United States,,608,Capital Goods,Industrial Specialties
PLAB,Photronics Inc. Common Stock,$13.12 ,0.175,1.35%,838261776,United States,1987,56638,Technology,Semiconductors
PLAY,Dave & Buster's Entertainment Inc. Common Stock,$40.29 ,0.75,1.90%,1919497348,United States,2014,48274,Consumer Services,Restaurants
PLBC,Plumas Bancorp,$25.75 ,0.46,1.82%,133436500,United States,,5342,Finance,Finance Companies
PLCE,Children's Place Inc. (The) Common Stock,$71.45 ,0.77,1.09%,1042246723,United States,1997,25759,Consumer Services,Clothing/Shoe/Accessory Stores
PLIN,China Xiangtai Food Co. Ltd. Ordinary Shares,$1.31 ,0.0494,3.92%,31286839,China,2019,86023,Consumer Non-Durables,Meat/Poultry/Fish
PLL,Piedmont Lithium Limited American Depositary Receipts,$56.70 ,0.995,1.79%,654997335,Australia,,129187,,
PLMR,Palomar Holdings Inc. Common stock,$87.52 ,-0.68,-0.77%,2233419117,United States,2019,3078,Finance,Property-Casualty Insurers
PLPC,Preformed Line Products Company Common Stock,$72.95 ,1.5499,2.17%,358515420,United States,,1994,Basic Industries,Water Supply
PLRX,Pliant Therapeutics Inc. Common Stock,$34.40 ,0.2726,0.80%,1220599191,United States,2020,1974,Health Care,Major Pharmaceuticals
PLSE,Pulse Biosciences Inc Common Stock (DE),$31.58 ,-0.627,-1.95%,823115356,United States,2016,1148,Health Care,Medical/Dental Instruments
PLTK,Playtika Holding Corp. Common Stock,$31.41 ,-0.09,-0.29%,12865086837,Israel,2021,52704,Technology,EDP Services
PLUG,Plug Power Inc. Common Stock,$47.36 ,0.78,1.68%,25324217580,United States,1999,3825866,Energy,Industrial Machinery/Components
PLUS,ePlus inc. Common Stock,$91.44 ,1.8,2.01%,1234746507,United States,1996,555,Technology,Retail: Computer Software & Peripheral Equipment
PLXP,PLx Pharma Inc. Common Stock,$7.20 ,-0.01,-0.14%,100163758,United States,2014,1001,Health Care,Major Pharmaceuticals
PLXS,Plexus Corp. Common Stock,$82.01 ,-0.03,-0.04%,2363429132,United States,,2293,Technology,Electrical Products
PMBC,Pacific Mercantile Bancorp Common Stock,$7.50 ,0.13,1.76%,177438113,United States,2000,5951,Finance,Major Banks
PMD,Psychemedics Corporation,$7.27 ,0.0397,0.55%,40175946,United States,,687,Health Care,Medical Specialities
PME,Pingtan Marine Enterprise Ltd.,$1.47 ,-0.0148,-1.00%,116193918,China,,15785,,
PMVP,PMV Pharmaceuticals Inc. Common Stock,$36.91 ,0.14,0.38%,1652599039,United States,2020,722,Health Care,Major Pharmaceuticals
PNFP,Pinnacle Financial Partners Inc. Common Stock,$83.54 ,0.62,0.75%,6336413180,United States,,12413,Finance,Major Banks
PNNT,PennantPark Investment Corporation Common Stock,$5.82 ,0.1,1.75%,390202511,United States,2007,46250,,
PNRG,PrimeEnergy Resources Corporation Common Stock,$54.02 ,-1.98,-3.54%,107725442,United States,,531,Energy,Oil & Gas Production
PNTG,The Pennant Group Inc. Common Stock ,$56.37 ,-0.24,-0.42%,1589043186,United States,,2498,Health Care,Medical/Nursing Services
POAI,Predictive Oncology Inc. Common Stock,$1.52 ,0.0314,2.11%,23461519,United States,,730185,Health Care,Industrial Specialties
PODD,Insulet Corporation Common Stock,$269.44 ,8.7,3.34%,17763605562,United States,2007,141354,Health Care,Medical/Dental Instruments
POLA,Polar Power Inc. Common Stock,$14.37 ,0.1754,1.24%,183707651,United States,2016,38238,Miscellaneous,Industrial Machinery/Components
POOL,Pool Corporation Common Stock,$316.95 ,-1.3,-0.41%,12728262565,United States,1995,26997,Consumer Durables,Industrial Specialties
POSH,Poshmark Inc. Class A Common Stock,$62.48 ,-0.44,-0.70%,4570283104,United States,2021,38024,Consumer Services,Catalog/Specialty Distribution
POWI,Power Integrations Inc. Common Stock,$91.00 ,-0.76,-0.83%,5464901169,United States,1997,18363,Technology,Semiconductors
POWL,Powell Industries Inc. Common Stock,$30.43 ,0.21,0.70%,355266385,United States,,867,Consumer Durables,Electrical Products
POWW,AMMO Inc. Common Stock,$7.70 ,0.2186,2.92%,528706197,United States,,123842,Capital Goods,Ordnance And Accessories
PPBI,Pacific Premier Bancorp Inc,$40.15 ,0.7,1.77%,3793497910,United States,,168812,Finance,Major Banks
PPBT,Purple Biotech Ltd. American Depositary Shares,$5.22 ,0.07,1.36%,91405196,Israel,2015,28087,Health Care,Major Pharmaceuticals
PPC,Pilgrim's Pride Corporation Common Stock,$22.71 ,0.01,0.04%,5530168648,United States,,10978,Consumer Non-Durables,Meat/Poultry/Fish
PPD,PPD Inc. Common Stock,$37.22 ,0.89,2.45%,13014138592,United States,2020,114832,Health Care,Biotechnology: Commercial Physical & Biological Resarch
PPSI,Pioneer Power Solutions Inc. Common Stock,$6.18 ,0.19,3.17%,53926958,United States,,36708,Consumer Durables,Electrical Products
PPTA,Perpetua Resources Corp. Common Shares,$6.89 ,0.015,0.22%,327193831,Canada,,6100,Basic Industries,Precious Metals
PRAA,PRA Group Inc. Common Stock,$37.37 ,0.085,0.23%,1703096065,United States,2002,9238,Finance,Finance: Consumer Services
PRAH,PRA Health Sciences Inc. Common Stock,$153.31 ,25.58,20.03%,9834779162,United States,2014,401925,Health Care,Biotechnology: Commercial Physical & Biological Resarch
PRAX,Praxis Precision Medicines Inc. Common Stock,$49.58 ,1.05,2.16%,1897024655,United States,2020,354,Health Care,Major Pharmaceuticals
PRCH,Porch Group Inc. Common Stock,$19.40 ,0.335,1.76%,1580238444,United States,2020,82025,Technology,Computer Software: Prepackaged Software
PRDO,Perdoceo Education Corporation Common Stock,$13.75 ,0.14,1.03%,952695686,United States,,12174,Consumer Services,Other Consumer Services
PRFT,Perficient Inc. Common Stock,$56.21 ,-0.98,-1.71%,1855398229,United States,1999,9132,Technology,EDP Services
PRFX,PainReform Ltd. Ordinary Shares,$6.75 ,0.3695,5.79%,59112229,Israel,2020,23057,Health Care,Major Pharmaceuticals
PRGS,Progress Software Corporation Common Stock (DE),$44.20 ,-0.42,-0.94%,1954358294,United States,1991,4626,Technology,Computer Software: Prepackaged Software
PRIM,Primoris Services Corporation Common Stock,$35.81 ,1.27,3.68%,1722329148,United States,,39095,Basic Industries,Water Supply
PRLD,Prelude Therapeutics Incorporated Common Stock,$68.76 ,0.65,0.95%,3202729478,United States,2020,1522,Health Care,Major Pharmaceuticals
PROF,Profound Medical Corp. Common Stock,$23.03 ,-0.38,-1.62%,451985721,Canada,,8368,Health Care,Medical/Dental Instruments
PROG,Progenity Inc. Common Stock,$5.65 ,0.0944,1.70%,308989941,United States,1995,10887,Health Care,Medical Specialities
PROV,Provident Financial Holdings Inc. Common Stock,$16.19 ,0.09,0.56%,120490092,United States,,763,Finance,Savings Institutions
PRPH,ProPhase Labs Inc. Common Stock (DE),$7.67 ,0.09,1.19%,116233121,United States,,15380,Health Care,Major Pharmaceuticals
PRPL,Purple Innovation Inc. Common Stock,$37.08 ,0.03,0.08%,2389620600,United States,2015,6683,Consumer Durables,Home Furnishings
PRPO,Precipio Inc.  Common Stock,$2.71 ,0.05,1.88%,46684942,United States,,20476,Capital Goods,Biotechnology: Laboratory Analytical Instruments
PRQR,ProQR Therapeutics N.V. Ordinary Shares,$4.48 ,0.13,2.99%,224654994,Netherlands,2014,22138,Health Care,Major Pharmaceuticals
PRTA,Prothena Corporation plc Ordinary Shares,$21.38 ,0.27,1.28%,853519810,United States,,9073,Health Care,Major Pharmaceuticals
PRTH,Priority Technology Holdings Inc. Common Stock,$8.99 ,-0.17,-1.86%,604303566,United States,2016,14763,Miscellaneous,Business Services
PRTK,Paratek Pharmaceuticals Inc. Common Stock,$7.48 ,-0.05,-0.66%,341396221,United States,,20978,Health Care,Major Pharmaceuticals
PRTS,CarParts.com Inc. Common Stock,$17.99 ,-0.1359,-0.75%,851490997,United States,2007,51685,Consumer Services,Other Specialty Stores
PRVB,Provention Bio Inc. Common Stock,$13.95 ,-0.03,-0.22%,875193579,United States,2018,96650,Health Care,Major Pharmaceuticals
PS,Pluralsight Inc. Class A Common Stock,$20.78 ,-0.13,-0.62%,3103738848,United States,2018,38690,Technology,Computer Software: Programming Data Processing
PSAC,Property Solutions Acquisition Corp. Common Stock,$16.00 ,0.4,2.56%,472264176,United States,2020,183010,Capital Goods,Auto Manufacturing
PSEC,Prospect Capital Corporation Common Stock,$7.61 ,0.1684,2.26%,2934262506,United States,2004,532521,,
PSHG,Performance Shipping Inc. Common Shares,$6.43 ,0.07,1.10%,32681928,Greece,,1717,Transportation,Marine Transportation
PSMT,PriceSmart Inc. Common Stock,$103.76 ,4.22,4.24%,3189409536,United States,,103360,Consumer Services,Department/Specialty Retail Stores
PSNL,Personalis Inc. Common Stock,$33.12 ,-0.82,-2.42%,1289454502,United States,2019,44068,Health Care,Medical Specialities
PSTI,Pluristem Therapeutics Inc. Common Stock,$6.49 ,0.01,0.15%,204624943,Israel,,44490,Health Care,Biotechnology: Biological Products (No Diagnostic Substances)
PSTV,PLUS THERAPEUTICS Inc. Common Stock ,$3.20 ,0.1,3.23%,15294669,United States,,69598,Health Care,Medical/Dental Instruments
PSTX,Poseida Therapeutics Inc. Common Stock,$12.15 ,2,19.70%,751113122,United States,2020,197571,Health Care,Biotechnology: Biological Products (No Diagnostic Substances)
PT,Pintec Technology Holdings Limited American Depositary Shares,$1.60 ,0.0363,2.33%,68861598,China,2018,180958,Technology,Computer Software: Programming Data Processing
PTC,PTC Inc. Common Stock,$138.38 ,-1.75,-1.25%,16164225643,United States,,14468,Technology,Computer Software: Prepackaged Software
PTCT,PTC Therapeutics Inc. Common Stock,$57.43 ,0.135,0.24%,3918437312,United States,2013,18418,Health Care,Major Pharmaceuticals
PTE,PolarityTE Inc. Common Stock,$1.40 ,0.005,0.36%,93189937,United States,,348497,Health Care,Biotechnology: Biological Products (No Diagnostic Substances)
PTEN,Patterson-UTI Energy Inc. Common Stock,$7.13 ,0.2882,4.21%,1338222756,United States,1993,147679,Energy,Oil & Gas Production
PTGX,Protagonist Therapeutics Inc. Common Stock,$24.79 ,-0.92,-3.58%,1066433474,United States,2016,13746,Health Care,Major Pharmaceuticals
PTMN,Portman Ridge Finance Corporation Common Stock,$2.02 ,0.02,1.00%,141731745,United States,,61775,,
PTNR,Partner Communications Company Ltd. American Depositary Shares,$5.14 ,0.16,3.21%,944327816,Israel,,9739,Public Utilities,Telecommunications Equipment
PTON,Peloton Interactive Inc. Class A Common Stock,$122.24 ,-4.65,-3.67%,35999883530,United States,2019,592978,Energy,Consumer Electronics/Appliances
PTPI,Petros Pharmaceuticals Inc. Common Stock,$3.41 ,-0.0105,-0.31%,33305097,United States,,539,Health Care,Major Pharmaceuticals
PTSI,P.A.M. Transportation Services Inc. Common Stock,$59.00 ,0.59,1.01%,338336208,United States,1986,379,Transportation,Trucking Freight/Courier Services
PTVCB,Protective Insurance Corporation Class B Common Stock,$22.96 ,-0.01,-0.04%,327544306,United States,,7175,Finance,Property-Casualty Insurers
PTVE,Pactiv Evergreen Inc. Common stock,$16.17 ,0.055,0.34%,2863754382,United States,2020,6513,Consumer Durables,Containers/Packaging
PUBM,PubMatic Inc. Class A Common Stock,$55.16 ,9,19.50%,2638109961,United States,2020,285921,Technology,Computer Software: Programming Data Processing
PULM,Pulmatrix Inc. Common Stock,$1.68 ,-0.0099,-0.59%,57808012,United States,2014,296970,Health Care,Major Pharmaceuticals
PUYI,Puyi Inc. American Depository Shares,$6.28 ,-0.3897,-5.84%,378794260,China,2019,13536,Finance,Investment Managers
PVAC,Penn Virginia Corporation Common Stock,$14.96 ,0.3839,2.63%,565886739,United States,,35627,Energy,Oil & Gas Production
PVBC,Provident Bancorp Inc. (MD) Common Stock,$12.44 ,0.05,0.40%,236951447,United States,2015,795,Finance,Savings Institutions
PWFL,PowerFleet Inc. Common Stock,$7.80 ,0.25,3.31%,277050423,United States,,14982,Capital Goods,Telecommunications Equipment
PXLW,Pixelworks Inc.  Common Stock,$3.72 ,0.07,1.92%,189240875,United States,2000,45850,Technology,Semiconductors
PXS,Pyxis Tankers Inc. Common Stock,$1.60 ,0.0286,1.82%,34465632,Greece,,71882,Transportation,Marine Transportation
PYPD,PolyPid Ltd. Ordinary Shares,$12.71 ,0.3349,2.71%,235158757,Israel,2020,1102,Health Care,Medical/Dental Instruments
PYPL,PayPal Holdings Inc. Common Stock,$262.79 ,-2.21,-0.83%,3.07773E+11,United States,,1206328,Miscellaneous,Business Services
PZZA,Papa John's International Inc. Common Stock,$101.86 ,-0.04,-0.04%,3356509462,United States,1993,12066,Consumer Services,Restaurants
QADA,QAD Inc. Class A Common Stock,$65.61 ,-0.94,-1.41%,1358066442,United States,,1019,Technology,Computer Software: Prepackaged Software
QCOM,QUALCOMM Incorporated Common Stock,$135.83 ,-1.2877,-0.94%,1.54305E+11,United States,1991,849144,Technology,Radio And Television Broadcasting And Communications Equipment
QCRH,QCR Holdings Inc. Common Stock,$43.09 ,0.62,1.46%,680535753,United States,,1384,Finance,Major Banks
QDEL,Quidel Corporation Common Stock,$167.74 ,0.3152,0.19%,7098405218,United States,,48567,Health Care,Biotechnology: In Vitro & In Vivo Diagnostic Substances
QELL,Qell Acquisition Corp. Class A Ordinary Shares,$12.00 ,-0.11,-0.91%,569250000,United States,2020,116631,Finance,Business Services
QFIN,360 DigiTech Inc. American Depositary Shares,$26.55 ,-0.4564,-1.69%,4039109201,China,2018,211988,Finance,Finance: Consumer Services
QH,Quhuo Limited American Depository Shares,$7.63 ,-0.19,-2.43%,396045908,China,2020,5155,Miscellaneous,Business Services
QIWI,QIWI plc American Depositary Shares,$11.07 ,0.08,0.73%,694232633,Cyprus,2013,38144,Miscellaneous,Business Services
QK,Q&K International Group Limited American Depositary Shares,$2.87 ,0.0047,0.16%,155841313,China,2019,3628,Finance,Real Estate
QLGN,Qualigen Therapeutics Inc. Common Stock,$3.64 ,0.0925,2.61%,97280426,United States,2015,143795,Health Care,Major Pharmaceuticals
QLI,Qilian International Holding Group Ltd. Ordinary Shares,$5.98 ,-0.03,-0.50%,213785000,China,2021,13270,Health Care,Major Pharmaceuticals
QLYS,Qualys Inc. Common Stock,$98.69 ,-0.65,-0.65%,3850547366,United States,2012,34392,Technology,Computer Software: Prepackaged Software
QMCO,Quantum Corporation Common Stock,$8.02 ,0.045,0.57%,454155604,United States,,8179,Technology,Electronic Components
QNST,QuinStreet Inc. Common Stock,$23.68 ,-0.03,-0.13%,1262061144,United States,2010,10107,Miscellaneous,Business Services
QQQX,Nuveen NASDAQ 100 Dynamic Overwrite Fund Shares of Beneficial Interest,$26.51 ,-0.32,-1.19%,1085761454,United States,,8818,,
QRHC,Quest Resource Holding Corporation Common Stock,$3.09 ,0.09,3.00%,56797991,United States,,5035,Technology,Diversified Commercial Services
QRTEA,Qurate Retail Inc. Series A Common Stock ,$12.55 ,0.08,0.64%,5236129687,United States,,163254,Consumer Services,Catalog/Specialty Distribution
QRVO,Qorvo Inc. Common Stock,$172.60 ,0.38,0.22%,19549143228,United States,,61792,Technology,Semiconductors
QTNT,Quotient Limited Ordinary Shares,$4.99 ,0.07,1.42%,504654932,Switzerland,2014,62281,Health Care,Biotechnology: In Vitro & In Vivo Diagnostic Substances
QTRX,Quanterix Corporation Common Stock,$78.09 ,-0.26,-0.33%,2486099713,United States,2017,17162,Capital Goods,Biotechnology: Laboratory Analytical Instruments
QTT,Qutoutiao Inc. American Depositary Shares,$3.83 ,-0.14,-3.53%,1021943779,China,2018,417030,Technology,Computer Software: Programming Data Processing
QUIK,QuickLogic Corporation Common Stock,$6.86 ,0.2799,4.25%,75928659,United States,1999,25211,Technology,Semiconductors
QUMU,Qumu Corporation Common Stock,$9.15 ,-0.04,-0.44%,160491723,United States,,377,Technology,Computer Software: Prepackaged Software
QURE,uniQure N.V. Ordinary Shares,$36.11 ,-0.07,-0.19%,1606755652,Netherlands,2014,5632,Health Care,Major Pharmaceuticals
RAAC,Revolution Acceleration Acquisition Corp Class A Common Stock,$13.01 ,2.11,19.36%,498716662,United States,2021,5752610,Finance,Business Services
RADA,RADA Electronic Industries Ltd. Ordinary Shares,$13.70 ,0.08,0.59%,595745391,Israel,,46075,Technology,Electronic Components
RADI,Radius Global Infrastructure Inc. Class A Common Stock,$13.78 ,0.5714,4.33%,839279281,United States,,1731,Consumer Services,Real Estate
RAIL,FreightCar America Inc. Common Stock,$3.82 ,0.0801,2.14%,59344600,United States,2005,8727,Capital Goods,Railroads
RAPT,RAPT Therapeutics Inc. Common Stock,$18.78 ,-0.05,-0.27%,461147764,United States,2019,1798,Health Care,Major Pharmaceuticals
RARE,Ultragenyx Pharmaceutical Inc. Common Stock,$140.98 ,0.755,0.54%,9438169673,United States,2014,8590,Health Care,Major Pharmaceuticals
RAVE,Rave Restaurant Group Inc. Common Stock,$1.30 ,0.02,1.56%,23406375,United States,,31698,Consumer Non-Durables,Food Distributors
RAVN,Raven Industries Inc. Common Stock,$41.62 ,1.14,2.82%,1492234532,United States,,17160,Capital Goods,Specialty Chemicals
RBB,RBB Bancorp Common Stock,$19.59 ,-0.15,-0.76%,383296392,United States,2017,895,Finance,Major Banks
RBBN,Ribbon Communications Inc. Common Stock,$9.25 ,-0.1592,-1.69%,1345035154,United States,,42770,Technology,EDP Services
RBCAA,Republic Bancorp Inc. Class A Common Stock,$42.80 ,0.02,0.05%,894993967,United States,1998,2487,Finance,Major Banks
RBNC,Reliant Bancorp Inc. Common Stock,$21.96 ,0.14,0.64%,365730822,United States,,569,Finance,Major Banks
RCEL,Avita Therapeutics Inc. Common Stock,$24.77 ,0.7,2.91%,535741239,Australia,,2720,Health Care,Medical/Dental Instruments
