Symbol,Name,Last Sale,Net Change,% Change,Market Cap,Country,IPO Year,Volume,Sector,Industry
ISTR,Investar Holding Corporation Common Stock,$19.52 ,0.1384,0.71%,207068149,United States,2014,3751,Finance,Major Banks
ISUN,iSun Inc. Common Stock,$13.28 ,0.24,1.84%,84366153,United States,2016,30309,Technology,Semiconductors
ITAC,Industrial Tech Acquisitions Inc. Class A common stock,$10.38 ,0.02,0.19%,100454900,United States,2020,5379,Finance,Business Services
ITCI,Intra-Cellular Therapies Inc. Common Stock,$37.41 ,0.52,1.41%,2998694095,United States,,15095,Health Care,Major Pharmaceuticals
ITI,Iteris Inc. Common Stock,$5.96 ,0.09,1.53%,248177928,United States,,5717,Capital Goods,Telecommunications Equipment
ITMR,Itamar Medical Ltd. American Depository Shares,$23.32 ,0.46,2.01%,382004967,Israel,,547,Health Care,Medical/Dental Instruments
ITOS,iTeos Therapeutics Inc. Common Stock,$40.12 ,0.19,0.48%,1405995691,United States,2020,708,Health Care,Biotechnology: Biological Products (No Diagnostic Substances)
ITRI,Itron Inc. Common Stock,$105.09 ,7.84,8.06%,4245311167,United States,1993,63327,Capital Goods,Electrical Products
ITRM,Iterum Therapeutics plc Ordinary Share,$1.91 ,0.03,1.60%,291298350,Ireland,2018,3142556,Health Care,Major Pharmaceuticals
ITRN,Ituran Location and Control Ltd. Ordinary Shares,$21.05 ,-0.56,-2.59%,494157823,Israel,2005,8594,Technology,Electronic Components
IVA,Inventiva S.A. American Depository Shares,$15.65 ,0.41,2.69%,600625873,France,2020,400,Health Care,Major Pharmaceuticals
IVAC,Intevac Inc. Common Stock,$6.59 ,0.12,1.86%,158750602,United States,1995,929,Technology,Industrial Machinery/Components
IZEA,IZEA Worldwide Inc. Common Stock,$4.14 ,0.04,0.98%,225683476,United States,,385863,Consumer Services,Advertising
JACK,Jack In The Box Inc. Common Stock,$95.98 ,1.22,1.29%,2191018963,United States,,28046,Consumer Services,Restaurants
JAGX,Jaguar Health Inc. Common Stock,$2.42 ,0.135,5.92%,284525645,United States,2015,1045879,Health Care,Major Pharmaceuticals
JAKK,JAKKS Pacific Inc. Common Stock,$7.88 ,-0.04,-0.51%,38989594,United States,1996,5665,Consumer Non-Durables,Recreational Products/Toys
JAMF,Jamf Holding Corp. Common Stock,$37.95 ,-0.44,-1.15%,4424832811,United States,2020,14533,Technology,Computer Software: Prepackaged Software
JAN,JanOne Inc. Common Stock (NV),$7.36 ,0.2399,3.37%,17674137,United States,,15619,Consumer Services,Home Furnishings
JAZZ,Jazz Pharmaceuticals plc Common Stock (Ireland),$167.27 ,9.8,6.22%,9319281784,Ireland,2007,130266,Health Care,Major Pharmaceuticals
JBHT,J.B. Hunt Transport Services Inc. Common Stock,$144.73 ,0.22,0.15%,15291303420,United States,,6829,Transportation,Trucking Freight/Courier Services
JBLU,JetBlue Airways Corporation Common Stock,$19.47 ,0.32,1.67%,6122509896,United States,2002,1153996,Transportation,Air Freight/Delivery Services
JBSS,John B. Sanfilippo & Son Inc. Common Stock,$90.52 ,-0.18,-0.20%,1037903497,United States,1991,3200,Consumer Non-Durables,Specialty Foods
JCOM,j2 Global Inc. Common Stock,$108.13 ,-1.1476,-1.05%,4839853000,United States,1999,47571,Technology,Telecommunications Equipment
JCTCF,Jewett-Cameron Trading Company Common Shares,$10.50 ,-0.19,-1.78%,36636191,United States,,520,Consumer Services,RETAIL: Building Materials
JD,JD.com Inc. American Depositary Shares,$95.20 ,-4.27,-4.29%,1.47548E+11,China,2014,1799593,Consumer Services,Other Specialty Stores
JFIN,Jiayin Group Inc. American Depositary Shares,$5.11 ,0.0094,0.18%,276035335,China,2019,18360,Finance,Finance: Consumer Services
JFU,9F Inc. American Depositary Shares,$2.01 ,0.2101,11.67%,392353429,China,2019,921953,Finance,Finance: Consumer Services
JG,Aurora Mobile Limited American Depositary Shares,$5.97 ,-0.26,-4.17%,690866471,China,2018,508219,Technology,Computer Software: Programming Data Processing
JJSF,J & J Snack Foods Corp. Common Stock,$153.05 ,0.27,0.18%,2904833443,United States,1986,2673,Consumer Non-Durables,Specialty Foods
JKHY,Jack Henry & Associates Inc. Common Stock,$149.08 ,-0.23,-0.15%,11341599263,United States,1985,19768,Technology,EDP Services
JNCE,Jounce Therapeutics Inc. Common Stock,$11.11 ,0.16,1.46%,442749887,United States,2017,8765,Health Care,Biotechnology: Biological Products (No Diagnostic Substances)
JOBS,51job Inc. American Depositary Shares,$67.21 ,-0.35,-0.52%,4529990092,China,2004,2920,Technology,Diversified Commercial Services
JOUT,Johnson Outdoors Inc. Class A Common Stock,$126.01 ,0.8,0.64%,1274234794,United States,,363,Consumer Non-Durables,Recreational Products/Toys
JRJC,China Finance Online Co. Limited American Depositary Shares,$12.45 ,0.45,3.75%,30402402,China,2004,3972,Finance,Investment Bankers/Brokers/Service
JRVR,James River Group Holdings Ltd. Common Shares,$46.92 ,0.26,0.56%,1436228379,Bermuda,2014,2955,Finance,Property-Casualty Insurers
JUPW,Jupiter Wellness Inc. Common Stock,$5.95 ,0.105,1.80%,54588970,United States,2020,12922,Consumer Non-Durables,Package Goods/Cosmetics
JVA,Coffee Holding Co. Inc. Common Stock,$5.71 ,0.4389,8.33%,32589821,United States,2005,102498,Consumer Non-Durables,Packaged Foods
JYAC,Jiya Acquisition Corp. Class A Common Stock,$11.10 ,0.0299,0.27%,152370144,United States,2020,669,Finance,Business Services
JYNT,The Joint Corp. Common Stock,$37.69 ,0.805,2.18%,529140587,United States,2014,1623,Miscellaneous,Multi-Sector Companies
KALA,Kala Pharmaceuticals Inc. Common Stock,$8.76 ,-0.25,-2.78%,491084417,United States,2017,72698,Health Care,Major Pharmaceuticals
KALU,Kaiser Aluminum Corporation Common Stock,$117.89 ,-0.67,-0.57%,1864096603,United States,,10724,Capital Goods,Metal Fabrications
KALV,KalVista Pharmaceuticals Inc. Common Stock,$34.07 ,0.07,0.21%,794415846,United Kingdom,2015,10540,Health Care,Major Pharmaceuticals
KBAL,Kimball International Inc. Class B Common Stock,$12.83 ,0.2,1.58%,473194931,United States,,6144,Consumer Durables,Home Furnishings
KBNT,Kubient Inc. Common Stock,$8.90 ,0.54,6.46%,104629370,United States,2020,200144,Technology,EDP Services
KBSF,KBS Fashion Group Limited Common Stock,$4.32 ,-0.01,-0.23%,11194412,China,2013,1599,Consumer Non-Durables,Apparel
KC,Kingsoft Cloud Holdings Limited American Depositary Shares,$59.75 ,-1.56,-2.54%,13026561519,China,2020,112008,Technology,Computer Software: Prepackaged Software
KDMN,Kadmon Holdings Inc. Common Stock,$4.69 ,0.065,1.41%,804395712,United States,,72915,Health Care,Major Pharmaceuticals
KDNY,Chinook Therapeutics Inc. Common Stock,$15.46 ,0.045,0.29%,651558567,United States,2015,702,Health Care,Major Pharmaceuticals
KDP,Keurig Dr Pepper Inc. Common Stock,$31.12 ,-0.67,-2.11%,43793722509,United States,,205455,Consumer Non-Durables,Beverages (Production/Distribution)
KE,Kimball Electronics Inc. Common Stock,$24.19 ,0.16,0.67%,603711306,United States,,2263,Technology,Electrical Products
KELYA,Kelly Services Inc. Class A Common Stock,$21.95 ,0.25,1.15%,862563882,United States,,2916,Technology,Professional Services
KEQU,Kewaunee Scientific Corporation Common Stock,$12.38 ,-0.065,-0.52%,34203427,United States,,140,Capital Goods,Medical Specialities
KERN,Akerna Corp. Common Stock,$6.30 ,-0.06,-0.94%,88569854,United States,2018,91012,Technology,EDP Services
KFFB,Kentucky First Federal Bancorp Common Stock,$7.18 ,-0.022,-0.31%,59176975,United States,,545,Finance,Savings Institutions
KFRC,Kforce Inc. Common Stock,$50.15 ,-0.24,-0.48%,1101097312,United States,1995,6487,Technology,Professional Services
KHC,The Kraft Heinz Company Common Stock,$36.76 ,-0.36,-0.97%,44963940460,United States,,321092,Consumer Non-Durables,Packaged Foods
KIDS,OrthoPediatrics Corp. Common Stock,$56.86 ,1.85,3.36%,1111875750,United States,2017,764,Health Care,Medical/Dental Instruments
KIN,Kindred Biosciences Inc. Common Stock,$4.81 ,0.06,1.26%,189957165,United States,2013,6100,Health Care,Major Pharmaceuticals
KINS,Kingstone Companies Inc. Common Stock,$7.44 ,0.1875,2.59%,79396785,United States,,270,Finance,Property-Casualty Insurers
KINZ,KINS Technology Group Inc. Class A Common Stock,$10.18 ,-0.08,-0.78%,351210000,United States,2021,1767,Finance,Business Services
KIRK,Kirkland's Inc. COMMONSTOCK,$26.33 ,-0.16,-0.60%,375349843,United States,2002,17877,Consumer Services,Other Specialty Stores
KLAC,KLA Corporation Common Stock,$316.12 ,-2.66,-0.83%,48706078674,United States,1980,39272,Capital Goods,Electronic Components
KLDO,Kaleido Biosciences Inc. Common Stock,$9.88 ,0.12,1.23%,413314061,United States,2019,6520,Health Care,Biotechnology: Biological Products (No Diagnostic Substances)
KLIC,Kulicke and Soffa Industries Inc. Common Stock,$49.10 ,0.83,1.72%,3047980062,Singapore,,49605,Technology,Semiconductors
KLXE,KLX Energy Services Holdings Inc. Common Stock,$15.92 ,1.26,8.60%,135481079,United States,,8316,Energy,Oilfield Services/Equipment
KMDA,Kamada Ltd. Ordinary Shares,$6.35 ,-0.18,-2.76%,284117815,Israel,2013,32493,Health Care,Major Pharmaceuticals
KMPH,KemPharm Inc. Common Stock,$9.80 ,-0.11,-1.11%,184729833,United States,,196994,Health Care,Major Pharmaceuticals
KNDI,Kandi Technologies Group Inc Common Stock,$7.27 ,0.0741,1.03%,526481573,China,,232954,Capital Goods,Auto Manufacturing
KNSA,Kiniksa Pharmaceuticals Ltd. Class A Common Stock,$21.55 ,-0.29,-1.33%,1467017004,United States,2018,18914,Health Care,Major Pharmaceuticals
KNSL,Kinsale Capital Group Inc. Common Stock,$178.89 ,2.35,1.33%,4056703378,United States,2016,11825,Finance,Property-Casualty Insurers
KNTE,Kinnate Biopharma Inc. Common Stock,$29.82 ,0.085,0.29%,1291801034,United States,2020,16440,Health Care,Major Pharmaceuticals
KOD,Kodiak Sciences Inc Common Stock,$121.58 ,-4.07,-3.24%,6173305837,United States,2018,10534,Health Care,Biotechnology: Biological Products (No Diagnostic Substances)
KOPN,Kopin Corporation Common Stock,$9.47 ,-0.05,-0.53%,805452289,United States,1992,898767,Technology,Semiconductors
KOR,Corvus Gold Inc. Common Shares,$2.11 ,-0.06,-2.77%,267195303,Canada,,23207,Basic Industries,Precious Metals
KOSS,Koss Corporation Common Stock,$12.15 ,0.25,2.10%,102003782,United States,,38380,Consumer Non-Durables,Consumer Electronics/Appliances
KPTI,Karyopharm Therapeutics Inc. Common Stock,$14.56 ,-0.03,-0.21%,1076318880,United States,2013,84658,Health Care,Major Pharmaceuticals
KRKR,36Kr Holdings Inc. American Depositary Shares,$4.92 ,0.1108,2.30%,184502148,China,2019,57223,Miscellaneous,Business Services
KRNT,Kornit Digital Ltd. Ordinary Shares,$114.49 ,-0.94,-0.81%,5183869977,Israel,2015,1842,Capital Goods,Industrial Machinery/Components
KRNY,Kearny Financial Corp Common Stock,$11.68 ,0.29,2.55%,983459048,United States,,17742,Finance,Savings Institutions
KRON,Kronos Bio Inc. Common Stock,$28.16 ,-0.5399,-1.88%,1577909076,United States,2020,519,Health Care,Major Pharmaceuticals
KROS,Keros Therapeutics Inc. Common Stock,$63.87 ,0.72,1.14%,1480401278,United States,2020,5986,Health Care,Major Pharmaceuticals
KRTX,Karuna Therapeutics Inc. Common Stock,$132.18 ,0.54,0.41%,3543291894,United States,2019,2183,Health Care,Major Pharmaceuticals
KRUS,Kura Sushi USA Inc. Class A Common Stock,$27.84 ,0.0094,0.03%,233062715,United States,2019,2126,Consumer Services,Restaurants
KRYS,Krystal Biotech Inc. Common Stock,$78.53 ,1.965,2.57%,1741814694,United States,2017,7023,Health Care,Biotechnology: Biological Products (No Diagnostic Substances)
KSMT,Kismet Acquisition One Corp Ordinary Shares,$10.03 ,0.0016,0.02%,318503300,Russia,2020,1990,Finance,Business Services
KSPN,Kaspien Holdings Inc. Common Stock,$28.01 ,0.01,0.04%,53952470,United States,,274,Consumer Services,Consumer Electronics/Video Chains
KTCC,Key Tronic Corporation Common Stock,$7.88 ,0.16,2.07%,84786278,United States,1983,19944,Technology,Electrical Products
KTOS,Kratos Defense & Security Solutions Inc. Common Stock,$29.01 ,0.005,0.02%,3560541493,United States,,30857,Capital Goods,Military/Government/Technical
KTRA,Kintara Therapeutics Inc. Common Stock,$2.08 ,0.01,0.48%,63702117,United States,,49362,Health Care,Major Pharmaceuticals
KURA,Kura Oncology Inc. Common Stock,$32.09 ,-1.23,-3.69%,2119049961,United States,,206309,Health Care,Major Pharmaceuticals
KVHI,KVH Industries Inc. Common Stock,$13.99 ,0.3799,2.79%,256052369,United States,1996,2192,Technology,Radio And Television Broadcasting And Communications Equipment
KXIN,Kaixin Auto Holdings Ordinary Share,$3.68 ,-0.025,-0.68%,239360648,China,2017,212476,Consumer Durables,Automotive Aftermarket
KYMR,Kymera Therapeutics Inc. Common Stock,$49.27 ,-1.14,-2.26%,2190492023,United States,2020,5011,Health Care,Biotechnology: Biological Products (No Diagnostic Substances)
KZIA,Kazia Therapeutics Limited American Depositary Shares,$11.30 ,0.45,4.15%,106924397,Australia,,43513,Health Care,Major Pharmaceuticals
KZR,Kezar Life Sciences Inc. Common Stock,$5.71 ,0.13,2.33%,264944000,United States,2018,2209,Health Care,Major Pharmaceuticals
LABP,Landos Biopharma Inc. Common Stock,$13.27 ,-0.05,-0.38%,519695319,United States,2021,1094,Health Care,Major Pharmaceuticals
LAKE,Lakeland Industries Inc. Common Stock,$32.30 ,0.2843,0.89%,259079840,United States,1986,10387,Health Care,Industrial Specialties
LAMR,Lamar Advertising Company Class A Common Stock,$88.91 ,0.81,0.92%,8966400303,United States,1996,35904,Consumer Services,Real Estate Investment Trusts
LANC,Lancaster Colony Corporation Common Stock,$179.87 ,1.88,1.06%,4955238630,United States,,1049,Consumer Non-Durables,Packaged Foods
LAND,Gladstone Land Corporation Common Stock,$18.31 ,0.23,1.27%,441315054,United States,2013,9032,Consumer Services,Real Estate Investment Trusts
LANDM,Gladstone Land Corporation 5.00% Series D Cumulative Term Preferred Stock,$25.90 ,-0.045,-0.17%,624252315,United States,,160786,Consumer Services,Real Estate Investment Trusts
LARK,Landmark Bancorp Inc. Common Stock,$26.44 ,0.24,0.92%,125612157,United States,,304,Finance,Major Banks
LASR,nLIGHT Inc. Common Stock,$38.77 ,0.044,0.11%,1526376935,United States,2018,17787,Technology,Semiconductors
LATN,Union Acquisition Corp. II Ordinary Shares,$10.55 ,0.05,0.48%,263750000,United States,2019,27999,Finance,Business Services
LAUR,Laureate Education Inc. Class A Common Stock,$14.52 ,0.17,1.19%,3050253034,United States,2017,14402,Consumer Services,Other Consumer Services
LAZR,Luminar Technologies Inc.  Class A Common Stock,$29.33 ,0.13,0.45%,9501049919,United States,2019,389983,Capital Goods,Auto Parts:O.E.M.
LAZY,Lazydays Holdings Inc. Common Stock,$20.51 ,0.16,0.79%,193857464,United States,,11305,Consumer Durables,Automotive Aftermarket
LBAI,Lakeland Bancorp Inc. Common Stock,$16.13 ,0.19,1.19%,814236690,United States,,7940,Finance,Major Banks
LBC,Luther Burbank Corporation Common Stock,$10.61 ,0.08,0.76%,554057022,United States,2017,747,Finance,Major Banks
LBRDA,Liberty Broadband Corporation Class A Common Stock,$142.57 ,-0.815,-0.57%,34200377337,United States,,2148,Consumer Services,Television Services
LBRDK,Liberty Broadband Corporation Class C Common Stock,$145.67 ,-1.37,-0.93%,34945245794,United States,,19976,Consumer Services,Television Services
LBTYA,Liberty Global plc Class A Ordinary Shares,$25.30 ,0.02,0.08%,14608536705,United Kingdom,,58477,,
LBTYK,Liberty Global plc Class C Ordinary Shares,$25.20 ,0.055,0.22%,14550795454,United Kingdom,,49757,,
LCAP,Lionheart Acquisition Corp. II Class A Common Stock,$10.40 ,0.07,0.68%,305760000,United States,2020,3268,Finance,Business Services
LCNB,LCNB Corporation Common Stock,$17.63 ,0.3,1.73%,226692270,United States,,506,Finance,Major Banks
LCUT,Lifetime Brands Inc. Common Stock,$12.97 ,-0.0199,-0.15%,282333396,United States,1991,486,Capital Goods,Industrial Machinery/Components
LCY,Landcadia Holdings III Inc. Class A Common Stock,$10.55 ,0.025,0.24%,659062500,United States,2020,13545,Technology,Computer Software: Prepackaged Software
LE,Lands' End Inc. Common Stock,$29.58 ,-0.04,-0.14%,964537452,United States,,8702,Consumer Services,Clothing/Shoe/Accessory Stores
LECO,Lincoln Electric Holdings Inc. Common Shares,$117.19 ,0.12,0.10%,6969372739,United States,,3049,Technology,Industrial Machinery/Components
LEDS,SemiLEDS Corporation Common Stock,$5.23 ,-0.01,-0.19%,20979219,Taiwan,2010,7985,Technology,Semiconductors
LEGH,Legacy Housing Corporation Common Stock (TX),$16.94 ,-0.0548,-0.32%,409699017,United States,2018,670,Basic Industries,Homebuilding
LEGN,Legend Biotech Corporation American Depositary Shares,$27.88 ,0.11,0.40%,3603282378,United States,2020,13022,Health Care,Major Pharmaceuticals
LESL,Leslie's Inc. Common Stock,$23.66 ,-0.34,-1.42%,4421423248,United States,2020,24351,Consumer Services,Other Specialty Stores
LEVL,Level One Bancorp Inc. Common Stock,$22.07 ,0.065,0.30%,168439356,United States,2018,359,Finance,Major Banks
LEXX,Lexaria Bioscience Corp. Common Stock,$6.34 ,0.2514,4.13%,32368611,Canada,,5076,Health Care,Major Pharmaceuticals
LFMD,LifeMD Inc. Common Stock,$22.28 ,0.75,3.48%,532927062,United States,,49395,Basic Industries,Package Goods/Cosmetics
LFTR,Lefteris Acquisition Corp. Class A Common Stock,$10.87 ,0.14,1.31%,281395690,United States,2020,28115,Finance,Business Services
LFUS,Littelfuse Inc. Common Stock,$267.49 ,-1.65,-0.61%,6563513138,United States,,1459,Consumer Durables,Electrical Products
LFVN,Lifevantage Corporation Common Stock (Delaware),$8.63 ,0.05,0.58%,122257620,United States,,2052,Health Care,Major Pharmaceuticals
LGHL,Lion Group Holding Ltd. American Depositary Share,$3.93 ,0.415,11.82%,76422297,China,,738713,Finance,Investment Bankers/Brokers/Service
LGIH,LGI Homes Inc. Common Stock,$114.46 ,-1.35,-1.17%,2872994760,United States,2013,10540,Capital Goods,Homebuilding
LGND,Ligand Pharmaceuticals Incorporated Common Stock,$138.22 ,-2.96,-2.10%,2222759912,United States,,18954,Health Care,Major Pharmaceuticals
LGVN,Longeveron Inc. Class A Common Stock,$6.60 ,0.17,2.64%,123465613,United States,2021,16058,Health Care,Major Pharmaceuticals
LHCG,LHC Group Common Stock,$202.58 ,0.135,0.07%,6399801867,United States,2005,2207,Health Care,Medical/Nursing Services
LHDX,Lucira Health Inc. Common Stock,$22.77 ,1.62,7.66%,872381727,United States,2021,30194,Health Care,Biotechnology: In Vitro & In Vivo Diagnostic Substances
LI,Li Auto Inc. American Depositary Shares,$26.78 ,-0.21,-0.78%,24037571471,China,2020,1449659,Capital Goods,Auto Manufacturing
LIFE,aTyr Pharma Inc. Common Stock,$4.74 ,0.09,1.94%,48279071,United States,2015,42975,Health Care,Biotechnology: Biological Products (No Diagnostic Substances)
LILA,Liberty Latin America Ltd. Class A Common Stock,$11.55 ,0.03,0.26%,2679674070,United States,,16331,Consumer Services,Television Services
LILAK,Liberty Latin America Ltd. Class C Common Stock,$11.46 ,0.01,0.09%,2658793493,United States,,32492,Consumer Services,Television Services
LINC,Lincoln Educational Services Corporation Common Stock,$5.92 ,-0.08,-1.33%,156739868,United States,2005,9518,Consumer Services,Other Consumer Services
LIND,Lindblad Expeditions Holdings Inc. Common Stock,$19.51 ,0.04,0.21%,973064879,United States,2013,9568,Consumer Services,Transportation Services
LIQT,LiqTech International Inc. Common Stock,$10.86 ,0.732,7.23%,235221617,Denmark,,7729,Technology,Industrial Machinery/Components
LITE,Lumentum Holdings Inc. Common Stock,$89.75 ,-0.26,-0.29%,6794075000,United States,,61786,Capital Goods,Telecommunications Equipment
LIVE,Live Ventures Incorporated Common Stock,$22.97 ,-0.29,-1.25%,35722370,United States,,1248,Consumer Services,Other Specialty Stores
LIVK,LIV Capital Acquisition Corp. Class A Ordinary Shares,$10.13 ,-0.17,-1.65%,102642225,Mexico,2020,3700,Finance,Business Services
LIVN,LivaNova PLC Ordinary Shares,$70.05 ,-4.03,-5.44%,3404179011,United Kingdom,,135011,Health Care,Biotechnology: Electromedical & Electrotherapeutic Apparatus
LIVX,LiveXLive Media Inc. Common Stock,$4.16 ,0.021,0.51%,314066359,United States,,96113,Consumer Services,Restaurants
LIXT,Lixte Biotechnology Holdings Inc. Common Stock,$3.65 ,0.18,5.19%,45166202,United States,,2803,Health Care,Major Pharmaceuticals
LIZI,LIZHI INC. American Depositary Shares,$10.17 ,0.0938,0.93%,469367103,China,2020,89677,Technology,Computer Software: Programming Data Processing
LJPC,La Jolla Pharmaceutical Company Common Stock,$5.59 ,0.075,1.36%,152923974,United States,1994,20157,Health Care,Biotechnology: Biological Products (No Diagnostic Substances)
LKCO,Luokung Technology Corp Ordinary Shares,$2.08 ,0.1593,8.30%,518702983,China,,2622859,Technology,EDP Services
LKFN,Lakeland Financial Corporation Common Stock,$69.11 ,0.6401,0.94%,1744321508,United States,,2015,Finance,Major Banks
LKQ,LKQ Corporation Common Stock,$38.69 ,0.15,0.39%,11744465570,United States,,63054,Consumer Services,Motor Vehicles
LLIT,Lianluo Smart Limited Class A Common Stock,$8.88 ,0.2282,2.64%,3994711,China,,34544,Consumer Services,Other Specialty Stores
LLNW,Limelight Networks Inc. Common Stock,$3.41 ,-0.025,-0.73%,422679723,United States,2007,310048,Miscellaneous,Business Services
LMAT,LeMaitre Vascular Inc. Common Stock,$47.27 ,0.08,0.17%,961565631,United States,2006,1460,Health Care,Medical/Dental Instruments
LMB,Limbach Holdings Inc. Common Stock,$12.24 ,0.1747,1.45%,121808059,United States,,1920,Basic Industries,Engineering & Construction
LMFA,LM Funding America Inc. Common Stock,$1.68 ,0.0189,1.14%,44530806,United States,2015,273408,Finance,Finance: Consumer Services
LMNL,Liminal BioSciences Inc. Common Shares,$5.40 ,-0.07,-1.28%,158684103,Canada,,30752,Health Care,Major Pharmaceuticals
LMNR,Limoneira Co Common Stock,$15.41 ,0.02,0.13%,272752639,United States,,280,Consumer Non-Durables,Farming/Seeds/Milling
LMNX,Luminex Corporation Common Stock,$31.29 ,3.12,11.08%,1455782676,United States,2000,176742,Health Care,Medical/Dental Instruments
LMPX,LMP Automotive Holdings Inc. Common Stock,$19.85 ,0.2999,1.53%,196582552,United States,2019,4184,Consumer Durables,Automotive Aftermarket
LMRK,Landmark Infrastructure Partners LP Common Units,$12.39 ,-0.0055,-0.04%,315787592,United States,2014,16804,Consumer Services,Real Estate
LMST,Limestone Bancorp Inc. Common Stock,$14.85 ,-0.0226,-0.15%,111357831,United States,,2218,Finance,Major Banks
LNSR,LENSAR Inc. Common Stock,$9.61 ,0.1069,1.13%,102206070,United States,,21160,Health Care,Medical/Dental Instruments
LNT,Alliant Energy Corporation Common Stock,$47.62 ,-0.61,-1.27%,11899335601,United States,,90553,Public Utilities,Power Generation
LNTH,Lantheus Holdings Inc. Common Stock,$19.26 ,0.16,0.84%,1287942297,United States,2015,14601,Health Care,Biotechnology: In Vitro & In Vivo Diagnostic Substances
LOAC,Longevity Acquisition Corporation Ordinary Shares,$12.57 ,-0.13,-1.02%,33019153,China,2018,3634,Finance,Business Services
LOAN,Manhattan Bridge Capital Inc,$5.37 ,-0.02,-0.37%,51659105,United States,,2844,Consumer Services,Real Estate Investment Trusts
LOB,Live Oak Bancshares Inc. Common Stock,$52.98 ,2.09,4.11%,2249130589,United States,2015,69382,Finance,Major Banks
LOCO,El Pollo Loco Holdings Inc. Common Stock,$18.53 ,0.12,0.65%,675358018,United States,2014,9569,Consumer Services,Restaurants
LOGC,LogicBio Therapeutics Inc. Common Stock,$8.30 ,0.54,6.96%,263827834,United States,2018,45845,Health Care,Biotechnology: Biological Products (No Diagnostic Substances)
LOGI,Logitech International S.A. Ordinary Shares,$109.79 ,-0.7901,-0.72%,18545855489,United States,1997,49358,Technology,Computer peripheral equipment
LOOP,Loop Industries Inc. Common Stock,$9.99 ,-0.1599,-1.58%,423717014,Canada,,8859,Basic Industries,Major Chemicals
LOPE,Grand Canyon Education Inc. Common Stock,$110.22 ,1.36,1.25%,5166422741,United States,2008,7868,Consumer Services,Other Consumer Services
LORL,Loral Space and Communications Inc. Common Stock,$44.94 ,1.85,4.29%,1390117830,United States,,25754,Technology,Radio And Television Broadcasting And Communications Equipment
LOTZ,CarLotz Inc. Class A Common Stock,$9.25 ,-0.1311,-1.40%,1050816946,United States,2019,116486,Consumer Durables,Automotive Aftermarket
LOVE,The Lovesac Company Common Stock,$62.03 ,1.94,3.23%,910795050,United States,2018,66651,Consumer Services,Other Specialty Stores
LPCN,Lipocine Inc. Common Stock,$1.65 ,0.022,1.35%,144282080,United States,,99623,Health Care,Major Pharmaceuticals
LPLA,LPL Financial Holdings Inc. Common Stock,$134.70 ,-0.715,-0.53%,10704309573,United States,2010,46399,Finance,Investment Bankers/Brokers/Service
LPRO,Open Lending Corporation Class A Common Stock,$37.78 ,-0.12,-0.32%,4369253562,United States,,13406,Finance,Finance: Consumer Services
LPSN,LivePerson Inc. Common Stock,$58.82 ,-0.65,-1.09%,3934186405,United States,2000,46068,Technology,Computer Software: Prepackaged Software
LPTH,LightPath Technologies Inc. Class A Common Stock,$4.26 ,-0.13,-2.96%,111349124,United States,1996,160563,Technology,Semiconductors
LPTX,Leap Therapeutics Inc. Common Stock,$2.63 ,0.0211,0.81%,156965485,United States,,23136,Health Care,Major Pharmaceuticals
LQDT,Liquidity Services Inc. Common Stock,$16.36 ,0.39,2.44%,571347675,United States,2006,72874,Miscellaneous,Business Services
LRCX,Lam Research Corporation Common Stock,$562.99 ,0.3399,0.06%,80455937971,United States,1984,82084,Technology,Industrial Machinery/Components
LRMR,Larimar Therapeutics Inc. Common Stock,$17.68 ,0.01,0.06%,271497722,United States,2014,613,Health Care,Major Pharmaceuticals
LSCC,Lattice Semiconductor Corporation Common Stock,$46.37 ,0.53,1.16%,6313547692,United States,,71727,Technology,Semiconductors
LSEA,Landsea Homes Corporation Common Stock,$8.90 ,-0.08,-0.89%,411456123,United States,2018,1897,Capital Goods,Homebuilding
LSTR,Landstar System Inc. Common Stock,$160.72 ,0.23,0.14%,6169408045,United States,1993,2513,Transportation,Trucking Freight/Courier Services
LSXMA,Liberty Media Corporation Series A Liberty SiriusXM Common Stock,$45.24 ,0.34,0.76%,15398114500,United States,,9383,Consumer Services,Broadcasting
